{
  "schemaVersion": "agent_observability.report.v1",
  "generatedAt": "2026-09-05T00:00:00Z",
  "title": "Legacy report fixture",
  "summary": {
    "generatedSpans": 1,
    "sessions": 1,
    "turns": 1,
    "llmRequests": 1,
    "toolExecutions": 0,
    "errors": 0,
    "inputTokens": 10,
    "outputTokens": 4,
    "cachedInputTokens": 0,
    "cacheCreationInputTokens": 0,
    "reasoningOutputTokens": 0,
    "latencyMs": 12,
    "durationMs": 12,
    "estimatedCost": 0
  },
  "cost": {
    "status": "unknown",
    "rate_table": {},
    "cost": { "assumption": "legacy fixture" }
  },
  "filters": {
    "repos": ["repo"],
    "sessions": ["session"],
    "turns": ["turn"]
  },
  "traces": [],
  "spans": [{
    "schemaVersion": "agent_observability.v1",
    "traceId": "trace",
    "spanId": "span",
    "parentSpanId": null,
    "kind": "llm.request",
    "name": "request",
    "status": "ok",
    "startTimeUnixMs": 1,
    "endTimeUnixMs": 2,
    "repo": "repo",
    "agent": { "name": "codex", "model": "gpt" },
    "sessionId": "session",
    "turnId": "turn",
    "attributes": {},
    "metrics": { "inputTokens": 10, "outputTokens": 4, "latencyMs": 12 },
    "cost": {
      "status": "unknown",
      "rate_table": {},
      "cost": { "assumption": "legacy fixture" }
    }
  }]
}
